sentiment_scores	genuineness_scores	summary
0.06878036	0.6683843	no calls
0.25657886	0.73274344	had these for 15 months
0.25500354	0.65229005	too flimsy doesn t fit right
0.17564899	0.5762305	awesome headphones no way you can do better in this price range 
0.9991261999999999	0.8931103000000001	super comfy and sound pretty good
0.99695015	0.82195413	great value for the price
0.9980252000000001	0.87426305	great headphones 
0.99181473	0.72031546	great device
0.9821651	0.7593783000000001	works well with iphone 5
0.74370503	0.74323714	great all around wireless headphones
0.9896406999999999	0.8960573000000001	what s not to like the quality i would expect from motorola 
0.9361335	0.7620385999999999	great value for the money
0.66026735	0.84036946	from horror to ok i like it 
0.9952148000000001	0.9092596	my first bluetooth 
0.9743253000000001	0.86535263	fantastic 
0.015830845	0.64352065	motorola s305 to buy or not to buy
0.99991655	0.8122621999999999	motorola bluetooth headset
0.9988438000000001	0.8847538	solid quality bluetooth headphones
0.94297117	0.8393111999999999	i lost my first pair and promptly purchased another one
0.98026717	0.8445523000000001	great product 
0.31888992	0.61975455	 updated dropouts dropouts dropouts junk
0.09278226	0.42570470000000005	meh
0.08075842	0.7030909000000001	mine just stopped 
0.100073725	0.7679249	beware if you re working out
0.04196852400000001	0.5429885	poor reception
0.9953684000000002	0.81403863	great
0.004369259	0.3097124	worst audio quality ever 
0.97805554	0.88708234	excellent headphones provided you have a good device to pair them with
0.9926475	0.686725	amazing product for the price
0.9061242	0.5743508	saudi arabia
0.9817005999999999	0.8084626	look ma no wires 
0.022404939	0.662211	not up to par with motorola quality that i ve grown accustomed to
0.9812985000000001	0.83256924	works perfectly after iphone update 
0.013035953000000001	0.61612785	atrocious sound quality and clunkiness
0.5762409000000001	0.5454965	amazing sound 
0.49480364	0.637571	brief comment
0.8943738000000001	0.8459306999999999	great for me but not so great for people who call me
0.98289543	0.8704945	super amazing affordable headset
0.024660617000000003	0.6643960999999999	think twice hard plastic hurts the ears changes the pitch of the song to keep up
0.016627728999999997	0.5574607	audio video out of sync with these headphones
0.62688583	0.8348329	good for workouts but questionable quality
0.54729027	0.8246690999999999	decent sound easy pairing good controls
0.9000073000000001	0.46981353	es bueno 
0.048478275999999994	0.38111985	not good for audio
0.9233600000000001	0.72821593	very good headphones
0.99611545	0.8535805000000001	a lot of bang for the buck 
0.17747879	0.6983261	if i could them less than 1 star i would
0.028796256	0.61679214	poor sound quality
0.99748445	0.7514341	awesome headset
0.9609601999999999	0.79551685	good overall sound and fit for the price iphone not fully compatible 
0.99718404	0.8694113000000001	durable and dependable
0.6939856	0.81900644	can cause a headache and are very heat sensitive
0.9943470999999999	0.9147346	excellent headphones for the price 
0.656713	0.8269334	only good if at 30 or below
0.8818633	0.7601726	unconfortable
0.04299295	0.74169505	poor quality
0.3472696	0.6597102	stopped working after a month
0.5033679	0.8067455	foam pads are not replaceable
0.8801768	0.8299719000000001	better than i expected 
0.97836375	0.86588013	great 
0.79837394	0.778357	cheaply made
0.97896093	0.87120223	perfect for what i was looking for
0.9982476999999998	0.78682727	bluetooth headphones
0.9777915999999999	0.7526795999999999	good headphones
0.57471883	0.6684856	good but 
0.95742464	0.79742265	excellent product
0.94715756	0.90596884	a good reason to go wireless
0.047579616	0.672639	broke after 1 week
0.95716166	0.89151514	great affordable bluetooth headset
0.99867547	0.87540746	works well with curve 8330
0.9922693000000001	0.8719609	takes a beating 
0.8973788	0.8055074000000001	wonderful 
0.47512576	0.7263866999999999	my first experience for blue tooth headphones is a good one 
0.9615519	0.7916877	my favorite headphones
0.004437804	0.6946939999999999	shut themselves off every 2 3 minutes poor sound quality 
0.6043590999999999	0.7531682	long lasting headphones
0.9959759	0.69639635	i like it
0.6015746	0.74192613	decent headset with good quality sound and some flaws
0.97008157	0.8488789000000001	glad i bought these 
0.9070319	0.86688876	great for bluetooth
0.18134576	0.72428757	good sound but uncomfortable with awkward buttons
0.022434592000000003	0.7068439999999999	sweat is a problem
0.81159246	0.82608706	decent inexpensive bluetooth headphones
0.9913166999999999	0.913905	excellent bluetooth headphones for reasonable price
0.91133916	0.87449396	writing 3 review for three bluetooth stereo headsets
0.09634927	0.66780144	uncomfortable poor quality and disappointing
0.8935559000000001	0.6142926	one word amazing
0.96558315	0.56562525	great purchase 
0.03351909	0.73479074	comfy okay sound cheap
0.31203383	0.6104835999999999	i love it 
0.95141375	0.7067258000000001	quality issues with this headset
0.99601376	0.8340719000000001	great bluetooth headphones
0.8675645000000001	0.83922386	excellent sound light weight and the s305 is great with an ipod touch
0.9199673	0.6495601	works great with iphone 4 but not with my macbook air
0.95589507	0.61549973	its okay haven t had no problem yet
0.5978229	0.5290201999999999	alright
0.9937154	0.8089217	convenient brilliant audio quality reception
0.023833215	0.6027938	not for outside use 
0.045128315999999995	0.7181159	horrible experience 
0.38608426	0.68504673	works well enough fit leaves something to be desired
0.9262278	0.739464	motorola s305
0.005293846	0.7655890999999999	ok headset if it could only recharge
0.80271065	0.89002055	a great pair of headphones for the money the fit is the only flaw 
0.016919404	0.3992712	worst packaging ever
0.9894270000000001	0.9191129000000001	solid choice for smartphone users
0.9689368	0.63714755	favorable review
0.84863305	0.92642844	excellent product great value 
0.996057	0.8109518	works perfectly with my android phone samsung epic 4g 
0.9996520000000001	0.8579998	great product
0.9784231	0.7943214	great value
0.0035839378999999996	0.42059082	i hate these 
0.651401	0.81243193	having windows 7 problems 
0.009620547	0.65722114	cheaply made does not last 
0.9837176999999999	0.83696914	motorokin in the free world
0.9890424999999999	0.81896347	best bang for my bluetooth buck
0.7613944	0.547665	good
0.050066917999999995	0.7795998000000001	nice headphones but 
0.99782914	0.8867697	nice
0.9891055000000001	0.8067963	for the price these can t be beat 
0.8117753000000001	0.7482258	great headset
0.9957531999999999	0.8020313	use them everyday 
0.6878003	0.7722864	best headset i have ever used unless you want to lay your head back 
0.9861186	0.7332890999999999	 earry sistable 
0.7528285	0.85380024	purchased for running 
0.9198799000000001	0.91874385	far surpassed expectations great bang for my buck 
0.9482924	0.8148850000000001	fantastic but mating with pc is not straightforward
0.93675494	0.81549656	bluetooth headset
0.014128566	0.40358967	not worth buying search for better rated
0.011051327	0.63401616	stopped working after 45 days
0.117836595	0.6346348	worked well but not for long
0.63425547	0.8170504	great for my workout 
0.0070024132999999995	0.5909871	you ll love em until they stop working 
0.0799382	0.6807641	buttons hard to use
0.99033856	0.67251396	headphones
0.23535424	0.7028892	only lasted 2 months
0.0069903134999999995	0.47364345	what a mistake i made
0.8869735999999999	0.8660876000000001	amazing 
0.08943388	0.71764976	don t exercise with them
0.27841997	0.6454935	blue tooth headset quit charging
0.9818412000000001	0.79090065	headsets are great 
0.6704116	0.72687995	best i ve used
0.013483196499999999	0.49869338	save your money
0.9039403	0.82523286	awesome headset
0.5457005	0.5967566	meh
0.9885384	0.88382983	wireless headphones
0.0015822947	0.68771064	lasted a year
0.026721299	0.35309	motorola s305
0.91528606	0.77895683	great range and battery life
0.03775093	0.50349355	they failed
0.99629086	0.8355924000000001	fully featured with my iphone 4
0.011626421999999999	0.6712009	great sound for the 30 minutes it worked
0.0822652	0.5506486999999999	did not work for me
0.7735287	0.79314744	very pleased with these headphones 
0.0137860775	0.7346543000000001	waste of money do not buy 
0.53278846	0.8265482	good headphone good construction
0.9206965	0.87966055	motorola s305 bluetooth stereo headset
0.9357860999999998	0.82035613	great lightweight blu tooth headset 
0.7228968000000001	0.43026173	great earphones 
0.63005394	0.79374397	well worth the money 
0.14398322	0.6856683000000001	worthless do not buy
0.99006116	0.87798107	not a better product out there for the 
0.5959287	0.68133557	great bluetooth headset
0.65286314	0.84390855	works like a charm
0.16613519	0.6797201	not good for biking
0.31700143	0.7730366999999999	buying my 3rd pair of these 
0.85575074	0.81042105	fits the bill perfectly
0.96834785	0.7095899999999999	discrete small dark unshiny perfect 
0.01627779	0.710674	they don t last long
0.013648808	0.711388	dead within 2 weeks
0.015339523999999998	0.6153569000000001	doesn t work with windows 8
0.20637470000000002	0.46988863	bluetooth headset for the pc not so much
0.030244201000000002	0.58577424	not worthed mediocre sound quality
0.8648263	0.8034100000000001	best bluetooth headphones
0.9788853000000001	0.8134562	 decent headphones would buy again
0.78756213	0.81070304	just like what everyone says amazing product bad with sweat
0.14044458	0.70834875	don t waste your time or money
0.9977627	0.87673867	look no further
0.87358266	0.7849986	great for iphone and working out
0.7839398	0.8868929	best for the money but some drawbacks
0.10303739	0.57591033	fooled by false review
0.9938748	0.8620896	amazing worked perfectly with ipod touch 3g
0.9026976000000001	0.8564538	everything and more
0.0088712275	0.5731721	will not pair with 2 devices at the same time
0.49757195	0.6704597	hide it 
0.08887294	0.56301814	bad luck 
0.6130984	0.67106616	pros and cons
0.9575529	0.7250659	great sound
0.7406446	0.71260816	awesome
0.69313675	0.62743825	excellent headset works great with blackberry
0.095814586	0.5243196999999999	barely lasted the night
0.97791356	0.8885911	motorola motorokr s305 bluetooth stereo headset
0.99179596	0.88289726	love this headset 
0.96861005	0.86551154	good headset
0.10187587	0.48128194	dissapointed
0.6664312	0.7490053000000001	works flawlessly with my iphone 4s for calls and music
0.010380447	0.519224	audio is choppy device seems flimsy
0.011181383999999999	0.62567645	not impressed go with artic p311
0.95930815	0.87807536	done with wires
0.93992126	0.7263851	working as advertised
0.70577306	0.6958361	it cannot be beat
0.9928104999999999	0.89006734	s305 bluetooth headphones
0.007485479000000001	0.5750827	poorly made but fairly good sound
0.9792509	0.8866493000000001	good headset for hands free use
0.0044884384	0.41500872	broke on day 2
0.7558123000000001	0.85415214	awesome must buy not so much now 
0.08341494	0.7480545	good bluetooth value for iphone imac
0.94058603	0.7352664000000001	bluetooth headphones to have 
0.012775689	0.6063659	do not buy
0.074650645	0.51030546	good bluetooth poor sound quality
0.48386999999999997	0.7712102	after 1 year
0.8308867	0.8514780000000001	comfort boo sound yay price booyah 
0.5414949	0.80719066	good for a while 
0.9904679	0.8797393	motorockin 
0.0031206608	0.48392147	cheaply made
0.5157944999999999	0.7309005999999999	so so 
0.96959686	0.7395314000000001	love this
0.1320912	0.7371411999999999	a bit faulty
0.9919114	0.8297038	best bluetooth headphones
0.92485356	0.9060787	not as sweatproof as i d thought 
0.3853413	0.6841003999999999	good for working out if you glow and not sweat 
0.9884006999999999	0.7417307	smart sexy and easy to use 
0.020022243000000002	0.50234044	don t even bother waste of money
0.9915233	0.83385426	one of the best bluetooth headphones for an awesome price 
0.9983857	0.9280158000000002	best headset ever almost 4 years old and still running strong 
0.9502903	0.8978461999999999	one of the better bt headphones out there
0.2745843	0.68137205	works right the first day turns to junk the second
0.02639988	0.43571576	good sucks good sucks dead
0.87661636	0.87075835	the advantages of bluetooth
0.42602468	0.61893356	good headphones faulty connections
0.99235046	0.75043154	so far so good
0.036415607	0.6130129	it hurt my ears 
0.6567414	0.7018784	solid performance
0.18878838	0.67489797	bad windows7 driver support on other platforms linux andriod perfect 
0.8149401	0.8481394	a great ipad accessory 
0.2557475	0.5552986999999999	highly uncomfortable
0.9754993000000001	0.7786525	paired with ipod touch works great for jogging
0.35402912	0.7332595999999999	excellent 
0.009442717	0.73530555	worked great for an hour 
0.5511543000000001	0.42396759999999994	very good but
0.9603925999999999	0.84718335	does its job 
0.17582554	0.6542033	can t use while reclining
0.31833687	0.6519844	sucky battery
0.76202565	0.7665895	good headsets
0.88376176	0.8192146999999999	good price good quality not too comfortable
0.23298289999999997	0.5473539000000001	meh
0.9846164000000001	0.7399193000000001	great for workouts
0.6447586	0.7854068000000001	works great as headphones for music
0.009964286999999999	0.69108677	severely flawed battery
0.61462504	0.74731714	they work well 
0.8720344000000001	0.8173921	works great 
0.9555031999999999	0.49073490000000003	my son loves it
0.07466107599999999	0.55944437	disappointed 
0.6606293000000001	0.78762674	not so reliable on the droid
0.69567376	0.82720095	breat buy for the 
0.026532441	0.5053736	not recommended
0.5432213	0.7081688	nice but not for me
0.023965776	0.7454354999999999	great concept but poor quality
0.060009807000000005	0.26303908	on my 6th pair they last 3 or 4 days junk if amazon replaces for free i ll keep swapping these junky things out 
0.046054005999999995	0.6420873	buy the rocketfish unless you like poor battery life and bad music controls
0.86317515	0.8662601000000001	love this headset and can t beat the quality n durability for the price
0.18941929999999998	0.75872934	easy to use but buzzing
0.9962902	0.7895751	a good headset
0.10322049	0.74314725	decent headset for the money
0.15832204	0.77545154	treasure inside if you can extract it from its packaging 
0.9270923000000001	0.7977009	excellent value
0.6468113	0.66397035	okay headphones but don t pay too much for them 
0.7291	0.7955495	good buy for money
0.09898692	0.5158206	broke easily
0.100951344	0.58023345	painful
0.8774556	0.76205325	good product
0.75327826	0.8177946999999999	my first bluetooth wireless headset
0.0076403619999999995	0.34887028	not satisfied
0.77247286	0.74823725	good but 
0.017282158	0.45894179999999996	does not work for windows 7 x64
0.34627914	0.5614766	okay for a motorola bluetooth headset
0.060399503	0.60927486	not a well made product
0.2847058	0.6762845999999999	wonderful headset needs improvement on battery life
0.9786741	0.93636477	the absolute best purchase for wireless listening 
0.7968975	0.77015376	not recommended if you wear glasses 
0.05849451	0.5441566999999999	not compatible with amazon android cloud player
0.62400186	0.76887846	great headphones if you can live with a couple annoyances 
0.009810984	0.7008671999999999	stopped working after three months
0.55186	0.6437688	good headphones
0.8907877000000001	0.7747549	good not great
0.98537666	0.81605744	great initial impression
0.9727403	0.7915298000000001	best headphones for active people
0.9844289	0.74757224	great for whatever
0.7699272	0.8420638	great bluetooth headphones for my iphone 3g
0.9587571	0.8807013000000001	an unknown necessity
0.13317513	0.43999106	best work out headphones ever 
0.0027095377000000004	0.8058284000000001	breaks easily
0.018054843	0.7841048	can t handle sweat
0.9868290000000001	0.9318474	excellent value
0.1901888	0.76768315	not comfy nor discrete
0.7723335	0.7692045999999999	good set
0.7240696	0.810153	wonderful should have tried these first 
0.86160153	0.74413115	it s good for the price
0.0037773252000000003	0.5003101	glad i didn t pay more 
0.7813574999999999	0.8280548000000001	it rubs against your jacket collar now that the weather is getting colder
0.9583681999999999	0.8321675999999999	exactly what i was looking for
0.022575766	0.6352241	unreliable poor sound quality poor connectivity
0.94816166	0.91715395	very pleasantly surprised 
0.9994056	0.84399724	amazing audio quality
0.92740583	0.85603154	lightweight secure i love this headset
0.007106810999999999	0.51659894	terrible bass and painful to wear
0.12646112	0.66017526	absolutely a waste of money
0.4279937	0.78826547	amazing sound
0.009883881	0.60137975	expected more coming from motorola
0.9661374	0.8432825999999999	good bang for your buck
0.17714596	0.6656850999999999	good for only 3 months sound quality poor compared to rocketfish
0.47232029999999997	0.6604482	good sound good fit but 
0.6274036999999999	0.8064251	intense audio decent range great bang for your buck 
0.7497935	0.7974299	quality for the money 
0.070608646	0.72288626	great sound lousy bluetooth lousy comfort
0.13960528	0.6165791	broke in 2 months
0.9753903	0.79525167	great price solid performance
0.99963635	0.8570287	works so well i bought two 
0.88825524	0.7934876999999999	better than expected
0.041262954	0.78197527	broke in 3 weeks
0.9275030999999999	0.88029915	works great
0.99705255	0.8616203000000001	great value at the amazon price
0.73253274	0.77071023	you active get these 
0.16219693	0.594284	received broken product
0.5531019	0.85967535	good headset for a great price 
0.54014236	0.76722264	i like them but beware of faulty battery
0.8688028	0.9109937	best wireless workout headphones yet
0.99512875	0.7936771	feel cheap and fragile but they are not 
0.001250267	0.6653409	very disapointed
0.9669950999999999	0.7866508000000001	motorokr headphones are awesome 
0.02167648	0.7393757	worked very well for three months
0.022279322	0.7352306	don t do business with motorola 
0.91568804	0.92074704	near perfect
0.99652493	0.8924525	great price great headphones
0.5922633	0.70368445	nice features for the price if you don t sweat
0.21436149	0.7186458	last two pairs defective
0.99493134	0.8389631	exactly what i was looking for
0.7894912	0.6415179	they seem to work great
0.21690500000000001	0.52697784	pretty good headphones
0.9729065999999998	0.85012376	if you use with an iphone make sure it has ios4
0.5149385999999999	0.9316124	good for inexpensive bt headphones
0.9090084	0.6076333	good product
0.21066046	0.7322183000000001	great until it breaks
0.119873375	0.64489776	worked great for a couple months
0.824509	0.7577229	works with iphone 3 0 
0.39193118	0.75414884	nice but can be improved
0.8423345	0.74127096	work great feels awful after a bit 
0.03735447	0.58051795	died after i tried to recharge it didnt recharge just blinked red 
0.9828388000000001	0.8461445	great cheap bluetooth headset 
0.12561136	0.7515715999999999	the best wireless bluetooth headphones that are wrap around headband style
0.65202415	0.78612673	useful in the short term 
0.97770786	0.8294908999999999	very happy with this purchase
0.32338116	0.68923783	motorola stereo bluetooth headsets aren t worth the cost 
0.9215188	0.8409421	pretty good headphones
0.9596232	0.64604336	great for father s day
0.82064104	0.87925065	just bought my second pair
0.9867321	0.7566161	four stars
0.025349826000000002	0.5534975000000001	horrible fit and design poor volume level
0.96118855	0.86626095	works better than others but the comfortwise 
0.3619482	0.6998757	great headphones
0.83168036	0.8570846999999999	almost great 
0.06777176	0.41916054	worked for one day
0.9627372999999999	0.91966707	works with almost everything i connect it to 
0.9249226	0.7887666999999999	great headphones buttons too easy to press
0.9873860000000001	0.85753566	nice for the price
0.18194756	0.697348	poor quality
0.011036038	0.7640971	great except for volume buttons
0.14324504	0.6090765	dissappointed 
0.07122365	0.7955011	well they used to be good 
0.7131202	0.75017124	great price good for calls music eh 
0.76556337	0.74878204	sweat kills them instantly
0.5709868	0.50799525	there might be better bluetooth headphones on the market
0.92300856	0.8321966000000001	easy but rattles
0.8252019	0.80559444	really impressed
0.21919194	0.7210511	good quality headphones
0.9238470999999999	0.36778143	a 
0.18331781	0.17538306	it would ve been good if i had received
0.89696866	0.7886285	works great with my iphone 3gs
0.9829356	0.83686984	high quality affordable price
0.37956062	0.6161599	great for less then 2 weeks 
0.7203430000000001	0.8323809999999999	awesome headphones
0.33972955	0.5716938	pretty darn good but far from perfect 
0.43232197	0.7169871999999999	good buy
0.077111304	0.38021259999999996	will not work with gym equipment
0.074986964	0.51565	not so good
0.27498803	0.6621449	great headphones but mediocre as a headset
0.33585770000000004	0.60840124	not the most comfortable
0.74213445	0.90402234	way better than expected 
0.046869457	0.6456104	this is a two days device
0.68554556	0.86882305	decent for the price 
0.6258323	0.7003888	not waterproof
0.7310770999999999	0.7444371999999999	good so far
0.9595841999999999	0.8557712	perfect so far
0.90595627	0.6658126	excellent 
0.17618415	0.54507345	bluetooth not here yet
0.74520826	0.6554183000000001	perfect for treadmill and elliptical
0.99872875	0.9263814	used it for over 400 workouts over the last 2 years love em 
0.741977	0.77377456	you get what you pay for 
0.31966656	0.39676213	bad quality bad music bad experience 
0.97417384	0.77390116	i m happy 
0.99469584	0.8644286	love these 
0.02569592	0.578754	not what i expected
0.9290219999999999	0.8491552	super headphones better than expected 
0.79094243	0.7380986999999999	very good product
0.9834629999999999	0.6561084	motorola s305 is perfect 
0.0041565895	0.6877207	not for working out
0.004321009000000001	0.5851101	don t buy
0.97529185	0.83848596	a fantastic piece of hardware
0.021853358	0.60381794	sucks
0.1202251	0.5078666000000001	sound is great 
0.6096537	0.8541360999999998	surprisingly good sound quality so so microphone
0.71110135	0.630614	good present for the person who stays up late
0.99135154	0.8329168	motorola bluetooth headphones
0.012076646000000002	0.54288214	dont buy this
0.968137	0.8351365	best definition ever
0.98895395	0.85615945	love these for the money awesome 
0.94799054	0.8321277	just what i wanted 
0.6471043000000001	0.77092636	good for the price
0.12477186	0.5036446	wast of 
0.028135985	0.6482532	don t leave charger plugged in
0.31542388	0.6244873000000001	don t shoot the messenger 
0.88383836	0.88143253	can work with glasses 
0.44345418	0.8488933000000001	i ve had this pair for exactly a year now and they have their pros and cons 
0.17433679	0.734857	do not buy if you sweat a lot
0.020208359	0.726046	optimistic but waste of money
0.09602466	0.40707517	motorola s305 bluetooth stereo headset w microphone
0.9960141	0.817005	motorola s305
0.031008273	0.7556095	ok for the price
0.98334897	0.5656554	five stars
0.90614843	0.8208175	just stop working
0.8945708	0.80564404	much better than the s9 pair
0.64317495	0.8214208000000001	uncomfortable and noisy in an odd way
0.5339769	0.52472526	great for running 
0.20784733	0.70729935	not a bad deal but still a little cheap craft
0.90799105	0.352018	motorola s305
0.051578075	0.663116	cheap cheap cheap cheap
0.95718235	0.7954661999999999	slightly disappointed but i got over it
0.9988915999999999	0.8517473	so glad 
0.26777738	0.72903717	worked great for a month
0.0006062984500000001	0.5864557	terrible and overpriced 
0.07494447	0.49826342	bad product
0.8859140999999999	0.8421525	great sound simple to use motorola s305
0.0072183609999999995	0.48908630000000003	not worth its reviews
0.61370134	0.8117342	very good but hope they will upgrade design someday
0.99703836	0.8553791999999999	iphone 4 flawless win7 need other drivers
0.6458425999999999	0.733995	these babies will last a lifetime
0.016557783	0.436014	horrible experience
0.9986149	0.87634695	excellent product very nice sound quality 
0.99604404	0.8774086	excellent product as advertised 
0.93953097	0.7938374	not the best design for me
0.29804534	0.6537050999999999	great so far with iphone 3gs 10 hours streaming stereo
0.41764623	0.59302706	i wanted to like these 
0.990001	0.976458	exceeded my expectations i love them 
0.9350895	0.81217545	really good 
0.94042695	0.86920816	great headphones for working out 
0.009690404	0.6094761	constantly loosing connection
0.95321786	0.86976194	worth the 33 despite battery life
0.9996164000000001	0.87901354	motorola s305
0.7859234	0.81015956	excellent for the price
0.5338951999999999	0.7801026999999999	consider this headphone
0.017435968	0.50192857	motorola s305 does not work with windows 7
0.01898551	0.47030732	junk almost no device work
0.8557764999999999	0.81842947	works well
0.21801353	0.7626636999999999	they are ok but i have had a high failure rate 
0.98487973	0.7574711999999999	wow 
0.26216	0.743034	meh not terrible but not great by any means 
0.9749106	0.8643533999999999	great headphones for working out 
0.6484623	0.78489137	buy them
0.34020045	0.70029616	overall good
0.87542826	0.8191223000000001	if you want a wireless headset you want these
0.09322742	0.65251386	won t charge x2
0.2164686	0.5677635999999999	pure garbage 
0.56647754	0.67213255	pretty decent headset for the price
0.13222137	0.64746183	not sweat resistant 
0.9519127000000001	0.823305	they work electronics engineer 
0.44372928	0.74670994	good value for the price but has downsides
0.07119548	0.7190403000000001	broke after one charge
0.996994	0.7567946	just right
0.36589944	0.46340254	bluetooth headset s305
0.25057757	0.6927207	such high hopes awful product 
0.14953953	0.6557405	sounds like a pair of crappy headphones 
0.021344692000000002	0.6548480999999999	died after 1 time use
0.9452125	0.89201957	great product
