sentiment_scores	genuineness_scores	summary
0.053150773	0.7139064	beware of fakes
0.0009652376	0.7047218000000001	stopped working after 60 days 
0.8130458	0.8176391	an awesome product with great customer support
0.5966134	0.8251755	mophie juice pack air case
0.08862597	0.68849534	fasle advertisement
0.93773615	0.5156714	great product
0.6792891	0.6468736999999999	i love my mophie
0.008992195	0.683175	good but not worth the price
0.80392337	0.6581344	looks good but does not charge 
0.6506773	0.7581066	mophie is very good but 
0.040970652999999996	0.44767633	unhappy
0.21689782	0.6720524	andrew de guttadauro
0.679157	0.75672066	great product and after sales support
0.021539778	0.56827974	good while it lasted
0.30651033	0.83746076	would not purchase again
0.8204643	0.73654747	adds more battery life and some comfort in a stressful day
0.0043815374	0.6012168999999999	fail 
0.11688784	0.7165714	coupon code buy the real thing 
0.09009871	0.66431606	disappointed
0.9863156	0.80122364	awesome case
0.98819363	0.8189204000000001	a must have
0.034463732999999996	0.68526524	lousy seller
0.027981073	0.65850073	thicker in real life
0.032221735	0.69998795	it s good but after a little bit of wear 
0.13241646	0.5407991999999999	mophie case
0.00068345666	0.6941571	knock offs from amazon seems to be true 
0.9672312	0.721811	mophie
0.0022827089000000004	0.7352227	horrible please read do not buy
0.80050904	0.7423126999999999	works well but a bit expensive
0.010755599	0.7561344	poor quality for the price
0.23849160000000003	0.7006433000000001	makes use of volume buttons much too difficult
0.3756136	0.5809321	short and sweet for white iphone users
0.98043364	0.6988739	love it
0.02935788	0.78027904	i do like my mophie
0.0062981546	0.80497277	counterfeit do not buy from these guys
0.66313386	0.52094734	i paid for a white one and received a black one 
0.04693693	0.7284403	not too happy
0.023843497	0.55945665	iphone battery pack
0.9791187	0.6979233	piece of mind 
0.6687472	0.49755952	can t believe i have to buy this in the first place 
0.32822490000000004	0.7642544	better than the original in some aspects
0.018127859	0.60923165	horrible experience do not purchase
0.94274557	0.59279406	love it
0.9612937	0.80343074	works well
0.77324855	0.55803406	heavy but good
0.0016164184	0.8839536	very cheaply made will break over time
0.014450878	0.59421754	disappointing
0.02929926	0.62183565	never closed ok and is peeling after 2 weeks of use 
0.991556	0.78573257	if you are picky you will love this 
0.9872699	0.9213261999999999	a savior if you need extra power
0.16579467	0.6655339	very poor
0.7300840000000001	0.49782625	found to be only for some
0.95481074	0.70405775	this is awesome
0.24244612	0.7215849	expected more
0.5079421	0.67936814	mophie case too tight for iphone 4s
0.5638158000000001	0.8549183000000001	the lack of the standard 30 pin connector may be an issue for some
0.047959417000000004	0.24118695	apple case
0.23077032	0.41499195	love it
0.18269077	0.8033916999999999	great product but use with caution
0.09561032	0.50070155	no good
0.6851194	0.5481756	a good iphone case charger system
0.92201114	0.82299435	not very satisfied
0.6385626999999999	0.74126816	nice case 
0.01419732	0.8475146000000001	beware of counterfeit fake mophie cases i got one 
0.0029032528	0.68338656	this item is cheap
0.9985400999999999	0.88264567	the best juice pack that i have used will power and even charge the iphone 4 effectively doubles your battery life
0.0062529147	0.6731581	not good for small hands
0.9866483	0.6663574999999999	love it 
0.9437931999999999	0.7551354	great case so far
0.73916155	0.78456634	great product but 
0.08324468	0.7066316	thought it was awesome 
0.015332282	0.7154783	fakes fakes fakes not amazon but this seller 
0.04217189599999999	0.6143158000000001	the first few weeks were great 
0.046429068	0.67298657	my mophie iphone 4 juicepack actually became deformed
0.5166350000000001	0.81818455	great until 
0.006504208	0.37692165	i never received my order 
0.95053154	0.89682496	great product with a couple of issues
0.14160562	0.6804168	buy a different mophie
0.95961654	0.8407954	thinner and lighter than expected
0.012342453	0.63000256	dont buy this product 
0.9916706	0.8465706000000001	to mophie or not to mophie
0.01738882	0.5108315999999999	used items sold as new 
0.97707367	0.7467658	awesome 
0.98636234	0.8054180000000001	a must for the iphone 4
0.05046743	0.6466156999999999	not much charge
0.008356482	0.65649784	fake product 
0.83048046	0.360228	how is the headphone port 
0.89689124	0.5099962	awesome product
0.9050488000000001	0.78519124	item works great
0.67070186	0.7549523	disappointed in mophie
0.9934430000000001	0.8920368000000001	best battery case out there support second to none
0.58148843	0.8476005999999999	much needed extra juice for iphone 4s
0.037880212	0.7808478	great while it works
0.9465974	0.68660355	works well 
0.40433547	0.68046117	blocks dock connector
0.039870977	0.69564676	beware of counterfeit items
0.9599232	0.85687935	the ultimate case
0.6004078	0.612525	eats iphone battery life
0.25284356	0.52984285	the usb slot broke
0.04424125	0.6741215	defective engineering bad customer service
0.96457475	0.74100435	great product but not for the active lifestyle and coffee spills 
0.0062598586	0.54208195	don t waste you money on this item
0.9541437	0.8095063	aesthetically sleek and useful but heavy and unreliable at charging
0.054166973	0.72964907	excited at first then a letdown
0.015547453999999999	0.84602463	charger input breaks easily
0.8238622999999999	0.69399077	so far so good
0.89971644	0.79313684	amazing product
0.91041625	0.79313564	best case ever 
0.0025914907	0.75308514	hang onto your receipt 
0.92421407	0.8659402	surprisingly i love this product
0.9282367	0.77362096	it saves you in the field
0.9391521	0.8689505999999999	great case when you are on the move and need some juice 
0.7902061	0.78665596	well the battery still works 
0.90661407	0.86713785	can be used with verizon phone
0.051045537	0.57255214	awful case quit working after 2 weeks
0.0023973882	0.6975378000000001	do not purchase from this vendor counterfeit product
0.8546219	0.6235602	mophie
0.81820256	0.8150399	battery function is great but case does not protect against even minor drops
0.0060399473	0.6831318000000001	i don t get it 
0.9830488000000002	0.8382518	love it highly recommended
0.015725821	0.7554736	sent me a counterfeit product
0.7637071999999999	0.77311647	mophie last less than a day
0.99474573	0.7897202	awesome 
0.0024475157	0.7167199000000001	knockoff 
0.015588969	0.8183433000000001	the mini usb connector fails frequently
0.9722569999999999	0.836362	hands down best product for iphone 4
0.005973041	0.74440837	total ripoff
0.93461466	0.89323795	had it a couple months here s the report 
0.972519	0.6646645	worth the money outstanding product
0.5028495	0.65927994	depends on your use and expectations
0.035939038	0.82296056	worst product ever
0.017569155	0.6961505	before you buy this don t buy it 
0.014756203	0.72176725	just stopped working
0.035096705	0.5059505999999999	no protection at all
0.010221958	0.6687883000000001	bought a second one and had same failure
0.0120458305	0.6879224	another counterfeit case victim
0.0008226931	0.66815543	junk will fail in very short time
0.9753728000000002	0.5761997	very satisfied 
0.0040402412	0.70838434	it didn t work 
0.020604521	0.8264286	fake product
0.018547773	0.78372097	disappointing
0.9071636000000001	0.6799804	excellent 
0.27818644	0.79089797	short term good long term fail
0.9929135	0.8154969	mophie juice pack air case and rechargeable battery for iphone 4
0.6893161999999999	0.8072066999999999	works but has some flaws
0.0012259483	0.70440006	counterfiet item
0.600485	0.79279524	great product for iphone users
0.9109216999999998	0.6850181	it s a life saver 
0.22366023	0.7981543000000001	love and hate there is no middle ground 
0.0161255	0.588705	can not turn off lights when charging
0.0009504556699999999	0.74561894	garbage
0.85632825	0.7157671	quality extended battery case 
0.024490476	0.7514946	cheap but still not worth the money
0.023263931	0.6262880999999999	never buy mophie again poor quality
0.9971732	0.8050401	i am very pleased
0.06392309	0.5392167	facher
0.053623437999999995	0.7853604999999999	great concept horribly built cheap product 
0.008245586999999999	0.6218925999999999	doubles charge but doesn t hold up
0.00485453	0.47681874	mofie
0.9858906	0.7831848000000001	great charging case
0.012377948	0.7331124	knockoff and fake
0.04593548	0.72461003	poor poor quality buyer beware 
0.37836587	0.41779345	so so
0.037555605	0.56720835	mophie juice pack air case
0.5834020000000001	0.37920028	mophie not working buy only in january
0.9637413	0.7637911999999999	good for more battery life adds some heft
0.22548110000000002	0.80070734	decent product but flawed
0.005502224	0.6965176	great concept but not well made 
0.055505008	0.7211456999999999	absolutely disgusted
0.046793967	0.5691715999999999	not durable 
0.9423963	0.8221950000000001	useful but a few caveats
0.5138638	0.6980299	mophie concept is great but 
0.9954351	0.80242085	great if you don t mind bulk 
0.015067786000000001	0.6138343	mophie juice pack
0.0028953254	0.7960031999999999	disappointed
0.20402789	0.49909762	best case
0.9573035	0.6833422	great 
0.8225822	0.6156301	sleek
0.028024882	0.6292549	caution avoid this mishap with this case
0.11130494	0.63758445	fake
0.02939701	0.6910075	port malfunction
0.9767091	0.8641152	buy this iphone 4 case 
0.012905598	0.7338928000000001	don t buy from here buy from authorized dealer 
0.034378946	0.68565094	a good start i guess
0.014616281	0.6035984999999999	poor quality manufacturing misaligned top and bottom halves
0.0056098998	0.6278045999999999	not sure this was a real mophie
0.9386636999999999	0.87861633	great case option for someone who needs extended battery life
0.27791893	0.6164569999999999	mophie battery extender
0.019916534	0.73137444	on my 4th one they stop charging after a couple of weeks
0.99693525	0.8751351999999999	super cool and functional
0.078175515	0.8614632999999999	why i hate this case callers hear their voice echo 
0.2919389	0.58461905	good little charger
0.0054982603	0.79654646	this is not a durable case works if you newver put it in your pocket 
0.9927617	0.85447544	must have accessory if you travel
0.99217033	0.7871989	iphone accessory luv it 
0.9950713999999999	0.8264519	mophie for iphone 4
0.7856522	0.8314098	awesome but does not last
0.15335542	0.58212125	ok product
0.9377216999999999	0.5813166000000001	my morphie juice pack rocks
0.6358275999999999	0.7638484999999999	beware of knockoff cases
0.86191005	0.6691991	iphone extend battery
0.98243356	0.69450676	great product 
0.24614602	0.66202056	mini usb port unusable after just a few weeks
0.13153726	0.6569687	nice case but a shame it does not work
0.89031065	0.8171491	most amazing 
0.96290684	0.70536846	keep your old chargers
0.9769604	0.9232408000000001	best looking case out there
0.042037487000000005	0.75879586	fails after moderate use
0.11047959	0.75279915	horrible life span
0.0063791275	0.6708803000000001	its a fake 
0.0047842264	0.78329337	counterfeit
0.72465026	0.27769309999999997	iphone battery up grade
0.9898781999999999	0.6812199999999999	excellent product 
0.0040732026	0.6416841999999999	counterfeit quit working mophie will not replace
0.36811858	0.28517708	satisfecho
0.57127905	0.82585657	no mophie for me
0.9766712	0.6307543999999999	nothing but the best
0.9761112	0.7164039000000001	buy from mophie website 
0.97494245	0.7889941	may the power be with you 
0.9922763000000001	0.7454569000000001	just awesome
0.9329315999999999	0.9059086999999999	fantastic product for iphone must have 
0.00043323636	0.67203677	you ll get ripped off too
0.8794953999999999	0.71114403	great battery life extension
0.9953136	0.79910254	works beautifully 
0.032601	0.6306348	knockoff product 
0.99782085	0.7202274999999999	i love this case 
0.5018906	0.7563535	the good the bad and the ugly reality 
0.00082448125	0.78746897	product most likely fake
0.056100428	0.6470035	slick design but thats all 
0.11735582	0.7995908	poorly made this time
0.008674026	0.67356336	let the buyer beware of fakes 
0.9953962	0.89360297	best battery pack
0.0031932294	0.86883175	counterfeit case breaks with no warranty do not buy 
0.05494016400000001	0.47075388	not available
0.9251739999999999	0.6686843000000001	great product
0.618941	0.6455382	i like much about this
0.9974129	0.7448533	love it
0.18419805	0.6973793	buy from best buy or directly from mophie
0.8297614	0.85870683	great for power hogs 
0.061638057	0.64307904	big problems
0.297148	0.59619844	doesn t last long
0.98384964	0.86936396	awesome product 
0.4636513	0.5705161	where s the juice 
0.8844097	0.7669951999999999	soooo much better than the 3g version
0.97369933	0.84860545	perfect with one slight problem
0.9710045	0.8348501	excellent design and a great product 
0.0055775642	0.8148896999999999	counterfeit mophie juice pack
0.009084523	0.78265834	not working after only four months
0.004425198	0.53573525	arrived damaged triad distribution did not respond to several inquiries
0.94027364	0.8618237	mostly very good 
0.9732171000000001	0.77570164	juice pack a dream come true 
0.99261177	0.8747975	great battery case for your iphone
0.14683512	0.72247666	very fragile
0.010656238	0.5787789000000001	fake 
0.025226533	0.7588786	while it works its a great product begins to break too quickly 
