sentiment_scores	genuineness_scores	summary
0.017967999	0.46177498	nice case slow poor customer service
0.17216566	0.7678255999999999	design flaw
0.98655367	0.694537	absolutely love it
0.033965886	0.6909734000000001	fit for purpose until it stopped working less than two months in 
0.0005991458999999999	0.8558324	junk
0.88964915	0.8700534	nice case worth the money 
0.96853316	0.81058884	2x battery life
0.9556399999999999	0.69428456	i m happy
0.17354447	0.5714229000000001	disappointed not as advertised
0.13062784	0.61700594	happy af first
0.37191278	0.67716783	good not as expected though 
0.03339812	0.50516903	dont buy this case
0.97296256	0.75673866	it is really nice 
0.0051968990000000005	0.709689	big let down theres a reason its not made by apple 
0.0873656	0.5849544	how to charge the case completely
0.018853992	0.64358515	be careful 
0.88759875	0.86035335	great adds bulk but does what it promises
0.10912776	0.8066428000000001	stop holding charge after 5 days
0.0076206326	0.53938127	boost no longer boosts 
0.08843863	0.7934183000000001	not a sturdy product
0.95179695	0.7691216	boost case 1700mah ordered from amazon
0.59222865	0.58904165	good product
0.93445617	0.83853143	well worth it 
0.99145484	0.5640736999999999	love love love it 
0.69571364	0.6590394	like the idea hasn t worked right
0.98006815	0.65877056	great case
0.86990786	0.8918529000000001	does work with iphone 4s ios 5
0.8987345999999999	0.6879236	booster of a case
0.46684512	0.6260138000000001	dont drop it
0.63446766	0.79125744	great case
0.9982313	0.80884767	boostcase
0.9268489999999999	0.6943326999999999	perfect
0.97686934	0.8153348000000001	awesome product charges and protects phone
0.45687005	0.74085546	worked great for a few months then started falling apart 
0.99066985	0.8137053000000001	great help for traveling
0.7282101	0.62745535	nice case so so battery life
0.98743606	0.797657	great low cost high quality case
0.17956367	0.84549516	disappointed
0.93559694	0.75864935	nice radio
0.93019754	0.56045794	excellent product very useful
0.018148928999999998	0.47409925	tossed it
0.9101154	0.66803163	boost case is amazing 
0.2657718	0.70439506	first day vs phonesuit vs mophie longterm
0.032336175	0.7703126	gone too soon 
0.8367176	0.67404747	great product
0.02940756	0.78068197	charging seems to be flakey at best
0.9989254999999999	0.88957477	great case excellent customer service
0.81863105	0.66605866	boost case
0.7924422	0.5555626	great product 
0.35689574	0.8125304	good battery boost but has issues 
0.95162	0.76916546	great product and excellent quality customer service 
0.0021939576	0.7124484999999999	poor hardware stay away
0.39944026	0.581224	heavy but ok
0.0032755136	0.6673954000000001	boost phone case for i phone it is supposed to double your battery life
0.98831236	0.8498950000000001	excellent case
0.088011175	0.6337972	great customer support
0.9908198	0.74019516	iphone case secondary battery 
0.65072125	0.57756364	great insurance
0.35723764	0.76307833	a lifesaver when you need it but not perfect
0.1893805	0.76940775	booster battery extender _ poor cusomer support
0.97523946	0.84426606	boost case vs mophie
0.9969795	0.6975179	love the boost
0.47016943	0.76066124	good case worth the money
0.55167544	0.7489307	great service 
0.033644885	0.6571853	good cheap alternative
0.8750514000000001	0.67148155	boost case for iphone 4s
0.56928396	0.8328718	excellent customer service
0.99395174	0.79248977	great case
0.9809985999999999	0.8936620999999999	great looking and functional
0.9648530000000001	0.7394514	stands behind their product
0.0058921874	0.7891735	charging not supported with iphone 4s
0.5467799	0.6984099	not for iphone 4s amended 10 26 2011
0.93127596	0.85123336	an absolute must have accessory case for the iphone 4
0.31318393	0.60442525	great but 
0.02776897	0.52972716	do not buy boost cases 
0.6121305	0.5834446999999999	great but misleading
0.36167055	0.7571912	dropped once
0.023703187999999997	0.64481694	disappointed
0.9954586	0.6772391	1 happy chicky
0.7728076	0.8749534999999999	worthy purchase
0.0056429505000000005	0.6862689999999999	not worth your money
0.05830607	0.6823064999999999	extends the battery but ruins the camera when using a flash
0.07605857	0.57784796	work great for a couple months
0.99766105	0.7092191	love the additional boost 
0.9733318000000001	0.8259201999999999	excellent case
0.47315390000000007	0.6511140000000001	good for that price
0.98253953	0.7550380999999999	perfect solution
0.7547722	0.7806634	random rattling sound
0.78669405	0.76592284	for the money this case cannot be beat 
0.8222040999999999	0.7903352	this product is just amazing 
0.970361	0.8254349	every iphone does not need this 
0.7264135	0.7563508000000001	clips broken however 
0.9711673000000001	0.752432	i love this charger
0.9335401	0.72495997	love the product and support is great 
0.9815421999999999	0.71751237	happy customer
0.14625970000000002	0.7351108000000001	battery does not hold the charge
0.99723756	0.8577559000000001	exactly what i needed 
0.5294945	0.802153	didn t work went with mophie 
0.047792733	0.6092175	works for about 4 months
0.43422285	0.61578774	great for extended battery life but 
0.53233385	0.8807016	iphone 4s roughly 55 more charge
0.08501306	0.6749736	very impressive customer service 
0.053676932999999996	0.7423857	works great but any problems forget customer service
0.9660243000000001	0.7938641	good case 
0.040570676	0.4691321	very dis appointed save your money and do not buy one of these
0.9795413000000001	0.62258756	perfect
0.5958996	0.7554265	beginning to have charging issues 
0.6341599	0.9011593000000001	good case a notch shy from perfect
0.032372594	0.7782800999999999	9 months owned and it s not my favorite
0.07625961	0.5714442	not quite sure yet 
0.99129283	0.827994	great product 
0.9408716	0.80567026	near perfect battery case
0.9714832	0.79999894	best of the best
0.98426586	0.8495002	yup it s great
0.99748695	0.89171237	iphone 4s compatible
0.9942162	0.8608322	great battery pack
0.9985391	0.72288746	great product service just as great 
0.97409654	0.617775	good product
0.67588025	0.78030896	a great battery pack
0.050805718	0.76136744	good but usb connector is fragile 
0.93351734	0.776699	awesome battery case for iphone 4s
0.99135774	0.7665814000000001	very very nice 
0.9986206	0.8416662	awesome phone case for an great price 
0.6607724	0.7427033000000001	great case for extending battery life
0.95946896	0.7290304	great product
0.2513044	0.7611475000000001	this device is warm
0.92669225	0.83573115	a really good product for the price
0.08543378	0.6180015	worst customer service experience ever
0.18732962	0.7612106	started great but going downhill fast
0.40476957	0.7017938	deserves only 2 stars not more
0.99796236	0.8043392	absolutely worth every penny
0.9084131999999999	0.7268758000000001	the boost my iphone needed 
0.47375566	0.5375842	stay away from this one
0.54260635	0.65640783	love hate
0.9447325000000001	0.7329709	loved the iphone again 
0.62951803	0.81888676	customer service is great 
0.95019865	0.80266	boast for the boost case
0.9868531999999999	0.82980955	a great enhancement for an already great phone 
0.9887703000000001	0.8128145	fantastic case clean understated design
0.07925743	0.7622424	good for a few months 
0.12333447	0.5775170000000001	boost case for i phone 4s
0.14599317	0.6371422	not good long charge time sometimes not at all
0.0205459	0.7868119	poor charge
0.9866389999999999	0.8749333	i never write reviews but this deserves it 
0.21065345	0.4472208	on and off by itself
0.8634185999999999	0.66513526	very nice job great product 
0.29944646	0.6885064999999999	camera in low light is bad
0.24423623	0.7492825	better and less expensive than mophie
0.32901856	0.81936944	outstanding case beyond oustanding customer service
0.8023251	0.8969526	long lasting battery almost worth five stars
0.9428015	0.8292559000000002	the best case for iphone 4
0.0030486584000000002	0.67782545	garbage product 
0.07479286	0.8283553	illegal knockoff 
0.99820673	0.7665063	boost to satisfaction
0.9343742	0.84530264	holster for boost case
0.7628385999999999	0.78161573	keeps my phone charged up all day long
0.9678456	0.838851	perfect for me iphone battery case
0.86213946	0.75639355	i am really satisfied overall 
0.99175024	0.7210079	i phone battery case
0.9197181000000001	0.6997913	this product is a life saver
0.98468536	0.823417	i m a believer 
0.2747908	0.5299562	fragil case
0.15172586	0.47596216	charge my iphone 80 
0.9612790000000001	0.809762	sturdy sleek and back up battery 
0.9491757	0.7518541999999999	worth every penny a life saver
0.41172236	0.5534226	elegant solution to poor battery performance of iphone 4s
0.79223883	0.68199944	very happy works beautifully with iphone 4s 
0.99808955	0.8594564	 works well 
0.78773594	0.8502501	works as intended but material not as durable
0.42389035	0.8152493000000001	very good product annoying error splat displayed
0.9901187	0.747417	boost case protective case extended battery for iphone 4
0.006265402	0.65750146	broke in 3 days 
0.33957633	0.8794414	better than mophie or ivyskin
0.9194524	0.6097600999999999	fantastic charger one fault
0.16611773	0.66002065	extended battery for iphone 4
0.8834525	0.79376066	wonderful product wonderful company
0.0011636615	0.6413603	bad product support warranty
0.72453666	0.6564663000000001	best case out there 
0.7209995	0.66617864	be aware of the connector
0.94558805	0.70225024	excellent product
0.6241720000000001	0.41320807	excellent
0.98352444	0.79473484	iphone battery case
0.11106816	0.7524164000000001	stopped working within 6 months no customer support
0.29529637	0.5718901	garbage 
0.7356713	0.80973834	works great not sure how to charge it though 
0.98864996	0.76991165	double battery life
0.95602465	0.8687627	this is awesome buy this now 
0.94238746	0.62131214	not necessary
0.5660429	0.8109702	excellent iphone case great price
0.80806744	0.7022154	can t beat it for the price
0.9794811	0.84774923	great product outstanding customer service
0.042331605999999994	0.60070145	works but not for long
0.9971267	0.8521744000000001	never fear being without your phone because of a dead battery 
0.97700226	0.8603190000000001	a year of use and still working great
0.10381326	0.7325470000000001	poorly designed power connector
0.11464733	0.7437508	drawbacks
0.16365805	0.7106149	alright 
0.89184237	0.7084564999999999	great as a backup 
0.9462596	0.85272235	this should be your first accessory for your iphone4
0.22575468	0.7174130999999999	a problem with 4s flash
0.98981464	0.6132126999999999	great product 
0.30515770000000003	0.6629146	beware product changed false advertisement
0.80523396	0.7736006	had a bad boost but great customer service 
0.43647304	0.7779001	almost there 
0.7879169	0.7383308000000001	great case even better customer service
0.9903016	0.84828246	great product and even better support 
0.9531056999999998	0.6538414	own it love it 
0.9913448	0.78042907	fantastic 
0.45725656	0.75401115	good case and now charging works
0.9648874	0.79933524	yes it works with iphone 4s
0.12436834	0.48901004	amended review
0.122618735	0.5684033000000001	mixed bag
0.9422869	0.73039186	boost case protective case extended battery for iphone 4
0.9875847	0.8187619	great alternate case 
0.9616473	0.88703805	great case for the iphone 4s
0.8434014000000001	0.6705972	best battery booster so far for the money 
0.0029685497	0.7136873	poor customer service no response to multiple emails
0.46166295	0.79920644	good value overall
0.84393597	0.86063766	highly recommended adds 60 more battery life 
0.96591294	0.81442195	an essential accessory is that a contradiction in terms 
0.65953827	0.8255242	recessed volume vibrate and sleep buttons
0.7506039000000001	0.60745996	never worked from day one got a replacement and its wonderful
0.99733806	0.67834663	wow wow all day long and the phone on 100 battery
0.9756164	0.7951989	must have for iphone 4s if you work in a remote location or travel 
0.91090953	0.82788086	love it but needs improvement
0.9428389000000001	0.61747736	gotta have it 
0.9227438	0.82784855	good overall but service from seller was beyond outstanding 
0.08661553	0.52920973	worked for one day now the battery won t charge 
0.9099159	0.7012286999999999	fabulous extension in battery life
0.079497635	0.6726254	i m disappointed
0.9987891	0.8651078000000001	love this case 
0.13230577	0.86469495	don t expect this case and battery to last 
0.99979794	0.90367687	best investment for your iphone4
0.96554756	0.7260639	great case and excellent service 
0.9995280999999999	0.8178919	very pleased
0.34871674	0.76921123	boost your uptime 
0.63026655	0.68684554	excelent battery extender little heavy
0.5784583000000001	0.5554231	no boost boost
0.020206302	0.53660774	iphone boost case refund made quickly
0.9910556	0.71772456	awesome 
0.57594186	0.73629344	false advertisment does not give the charge it states
0.008544505	0.72375196	dont buy
