sentiment_scores	genuineness_scores	summary
0.41568190000000005	0.5939428000000001	works great but distraction at night
0.038287252	0.8223027	voltage current output not as advertised 
0.9865706	0.74653995	works great for charging my two phones at the same time 
0.24509570000000003	0.55341655	it failed to charge phone when phone battery running out
0.19413403	0.7198536	some build quality issues
0.97213066	0.8572745	perfect for use with kindle usb charger
0.014567911999999999	0.547586	worthless
0.16098928	0.8303343000000001	does not provide 2 amp charging current
0.9737171999999998	0.87657046	does the job and an excellent value
0.38450655	0.7646725000000001	thanks for all the answers from all you folks
0.7658839	0.77567863	works well so far 
0.9951732	0.77561116	great use for fire and android phones on the run 
0.06728756400000001	0.48012087	car charger
0.034838438	0.6476841	charges my phone via usb mode not ac mode 
0.27370959999999994	0.56286854	not bad bulkey though
0.9705589	0.70476586	can you love a car charger 
0.88811743	0.78622097	good enough charger with 2 major design flaws
0.56348675	0.6149800999999999	very handy works great 
0.9815780000000001	0.89195144	just got it and it works fine
0.5184041	0.5902968000000001	good charger annoying blue light
0.11649209	0.53008467	not what i expected
0.9594469000000001	0.80063134	loved it
0.15043074	0.5311063	does not work with blackberry 9930
0.54304075	0.6953775999999999	works great but 
0.11556116	0.33317040000000003	did not fit 
0.97750604	0.73722756	works for ipad got one for my dad 
0.9023770000000001	0.71830744	great product
0.99803066	0.816986	why pay more 
0.9629064	0.88482106	use electrical tape to cover the blue light b l u e 
0.8931376	0.80432713	this one lasts
0.97485924	0.813535	great 
0.010964602	0.32222044	ok for the money
0.9414875	0.73961306	1a output per usb slot 2x available works very well
0.22817612	0.6758119	didn t work for me 
0.99909794	0.8755485000000001	good stuff
0.54915655	0.58781135	great product but it will blind you 
0.07446024	0.65168285	not much of a charger if your phone still dies 
0.16503879999999999	0.816002	led light works
0.13619679	0.66112435	the indicator light is too bright
0.118249804	0.6574403	works as described annoying blue light 
0.032400936	0.43056932	will not charge your iphone or ipad fast
0.98967683	0.8187673000000001	dual phone charger works great 
0.080926865	0.4715174	complete waste of money
0.31182805	0.68818367	good basic charger but blue led light is obnoxious
0.811895	0.7797550999999999	just as good as the more expensive ones 
0.15902933	0.7174321	broke
0.10321027	0.41992447	charges iphone not ipad
0.93670213	0.80785036	nice and reasonably priced
0.79709387	0.7969441999999999	works as ac charger right out of the box
0.64848155	0.7691026999999999	led is way to bright
0.37014216	0.6925771	insanely bright led
0.9841629000000001	0.89028	bulky cheap looking but functional
0.651983	0.7535510999999999	works great but 
0.7810335	0.7004676999999999	blue led light too bright
0.23211655	0.8733984	great but data pins not shorted
0.32634324	0.7506424	works fine for me 
0.036833674	0.7780241	poor quality
0.05205676	0.65033585	too weak for two smartphones
0.15912461	0.62062585	works mostly 
0.963785	0.6489423000000001	great
0.7548064	0.42211229999999994	great product highly satisfied recommend this product 
0.82610756	0.7841805000000001	great but
0.9992962	0.8046198	handy charger for usb connected devices
0.9360152	0.7708483	double the charge quarter of the price 
0.14555803	0.7259536	2amps 
0.07741949	0.7026533	does not actually charge at 2 1 amps
0.09033668	0.7862916999999999	charging variable depending on device 
0.7653464	0.78546387	works very well
0.98773825	0.76922655	works great 
0.7245543000000001	0.7865495	great quality great product great price
0.22324201	0.79690874	does not charge like a 2 1 amp output charger 
0.45475706	0.6123128999999999	great product annoying light
0.055841893	0.5721374	doesn t charge samsung exhibit ii 4g
0.6233382	0.66458035	will not work with nexus 7
0.7282811	0.24521625	kindle hd car charger
0.69574034	0.7561432	the device is still great but don t expect every device to take full 
0.7391244	0.6015583000000001	not fond of this unit
0.16855857	0.18911284	need a cord 
0.9750434000000001	0.8629545	great
0.9400891	0.79163796	great for kindle fire and ipad but 
0.9139245999999999	0.84574646	charges iphone 4 and android but the blue led is too bright 
0.70110327	0.93763065	a little modification 
0.06553346	0.67636186	does not charge android phones
0.99365497	0.77936006	just what i needed 
0.017023563000000002	0.62765956	won t charge my blackberry bold 9900
0.85679066	0.5395794	perfect answer for multiple needs
0.91061074	0.5519151	worth the money
0.42973834	0.30530733	usb car charge
0.006118923399999999	0.48753765	very short life
0.9923812	0.7879262	great choice
0.31441199999999997	0.7907548000000001	great if it s compatible with your device 
0.98627543	0.756474	works great
0.96331847	0.77674437	simple powerful what s not to like
0.103253126	0.7655318	burned up in 24v airplane 
0.47948100000000005	0.7582522	charges just fine but led is unreasonably bright and causes a safety concern
0.98352754	0.86282516	awesome device
0.99895555	0.7664579	amazon basics 2 port usb car charger
0.9647726000000001	0.747167	works well but blue light is annoying
0.014028609	0.727053	does not charge ipad 3
0.5554318	0.6715906999999999	works
0.84958065	0.76520514	works well light too bright
0.43161726	0.7579119000000001	break just as quickly as the 3 to 5 ones 
0.17617214	0.5973951999999999	never blown out 
0.9663815999999998	0.7754656	good charger blinding blue light
0.9306431999999999	0.797601	no hassle it just works bright led 
0.5525247	0.74116814	doesn t work with all usb charging electronics
0.15540671	0.49286547	this should have 5v 2 1a right 
0.97546625	0.83254063	works perfect 
0.9825480999999999	0.85165024	works as advertised
0.9549011999999999	0.56691384	recd and works as expected
0.86647606	0.7175718000000001	good charger works with any android smartphone
0.8658796000000001	0.7644310000000001	works well 
0.2559332	0.79020727	blinding 
0.9972112	0.8299936	convenience for my car
0.0022140442999999998	0.6203999	junk not compatible with iphone 5s
0.03357199	0.7132925999999999	broke after a few uses
0.9366013000000001	0.86396194	much better than griffin charger
0.8580796	0.81931746	a little bulky but the product works great and great price
0.4694778	0.72603935	too big and bulky
0.7550191999999999	0.8265505999999999	simple math 3 cars 3 chargers
0.31112158	0.8843334	needs modification to take advantage of 2 1a rating
0.19828677	0.70925987	won t charge my phone
0.12653354	0.6576285	poor quality product don t recommend it
0.8826495999999999	0.7961067	works great 
0.81767404	0.24398488	necessity when traveling
0.9509893	0.7560725	usb car charger
0.96537316	0.6585628000000001	works great 4 a kindle i ordered it again 
0.45763627	0.7376262	does not work for hp touchpad
0.18045643	0.62675	part of it works part of it doesn t
0.48470816	0.63000876	good product but led too bright
0.014539093000000001	0.5607348000000001	misleading description
0.99828124	0.8149705	works perfectly
0.95466405	0.67479116	loved this 
0.6406712	0.73704356	compact and functional
0.9155190000000001	0.65784514	awesome product 
0.05232951	0.73812145	bright light broke easily
0.033615917	0.689213	doesn t work with galaxy tab 8 9
0.3016468	0.58353055	no a fan of the indicator light
0.46087477	0.79128957	works great 
0.001090914	0.6808871	quit working
0.34449420000000003	0.5864176999999999	not powerful enough
0.7112826	0.8002864000000001	works but led light is overly bright
0.5396535	0.75066847	does what it designed for 
0.5205675999999999	0.6222998000000001	charger doesn t work for toshiba thrive
0.9843265999999999	0.7386408	works great 
0.18543783	0.56693393	dont buy it 
0.715431	0.8758396	does not have data pin shorting 2 1 amp spec not truly universal see customer pics for graph
0.11927083	0.7512288	worked fine but only couple of months
0.97806406	0.8114799	works for iphone 4s
0.42135417	0.7559299	the led light is very bright
0.23588184	0.14260495	kindle car charger 
0.17183986	0.6640710999999999	output not as described and extremely bright led
