sentiment_scores	genuineness_scores	summary
0.6153968000000001	0.73392266	perfect fit
0.98668194	0.8858545	great simple case
0.99743974	0.8464351000000001	fit perfect functional protects and i love the kick stand feature
0.87658703	0.7407334	great for the price
0.9463538	0.74919015	dropped it
0.9304783999999999	0.77834725	great case 
0.09408632	0.3999213	my screen still cracked
0.05119279	0.2540029	aduro shell holster
0.05409175	0.57349074	aduro shell holster combo case
0.075327694	0.45992297	wouldn t buy it
0.0058528185	0.44831216	wrong case sent
0.39649272	0.7125238	hard to rate meaningfully until you drop it
0.9960737	0.8632343000000001	just what i was looking for 
0.058676094000000005	0.52452016	nice case if you can get your phone out 
0.23009378	0.82319427	some things to take note 
0.0025456548	0.3225187	aduro shell holster combo case
0.848513	0.78849196	nice but there are others out there of same quality for less money
0.04881239	0.29990120000000003	i have not received the package
0.2519651	0.7566928	decent case can damage phone 
0.9983323000000001	0.8480135	great holster combo
0.12925699999999998	0.51998585	does not fit properly
0.9888719000000001	0.8566815999999999	good build
0.88429224	0.8158911999999999	so far the best case i ve tried
0.39808506	0.696995	great product if you do not plan to take off the case 
0.94763994	0.7164397	belt clip phone case
0.9957966999999999	0.88105977	sturdy convenient and reliable
0.98836637	0.7677518	impressed
0.5648164999999999	0.83975226	this product was not even ok 
0.96639436	0.869043	pleasantly surprised
0.8377331	0.83169246	better than average case 
0.009690106	0.8361119	ultimately useless
0.017188728	0.7009534000000001	not good
0.9820303	0.71496725	superb case for the galaxy siii
0.9441255	0.8217610000000001	good solution
0.8610388000000001	0.8530459	great choice
0.04709485	0.4274777	not good protection
0.91679335	0.7655510999999999	i love this case
0.18932137	0.62453455	not bad if you don t mind losing your phone
0.062032163	0.6055223000000001	broke the power button from my galaxy s3
0.99376607	0.83009446	affordable good quality
0.9882363999999999	0.8513731	perfect case
0.85821986	0.8253879000000001	should have gotten this first 
0.6510664	0.74439836	good case with 1 problem
0.44855252	0.78598523	great case but one fatal flaw
0.20786738	0.75611985	liked it until i broke it the first week
0.58745325	0.85547185	a really nice contemporary style case that is functional and protects your phone
0.6635826	0.74639165	seems like a decent case 
0.9755113000000001	0.86198914	five stars nice holster
0.96957874	0.8198506999999999	decent case for it s price 
0.9949485999999998	0.86147845	why pay 29 99 
0.92362416	0.7906654000000001	regretfully i m going to send it back
0.9838031999999999	0.8863424000000001	great holster case
0.9994265999999999	0.8490530000000001	do not hesitate
0.99899316	0.8463787	patience it is worth it 
0.96822417	0.9199815999999998	super case for the s3 
0.9860959999999999	0.68213904	perfect s3 case holster
0.99681365	0.8646269	one that works
0.97143006	0.8522165	nice case protective yet thin
0.99563885	0.7991600999999999	awesome product
0.99493575	0.8058046999999999	aduro case for galaxy siii
0.99696493	0.88395107	perfect design at a great price 
0.99620366	0.79060096	great shell and holster
0.98340356	0.7870684	awesome case for samsung galaxy s3
0.7251008000000001	0.81248975	great slimline case but use the belt clip with caution 
0.7649008	0.5543939999999999	best money i ever spent 
0.2905764	0.62486553	galaxy glass broken on the 1st day
0.042686343	0.44464067	not enough protections not nearly enough 
0.83143026	0.86643076	durable comfortable case careful with the buttons
0.97734845	0.8082144	aduro holster combo
0.011426747	0.47961318	my screen cracked 
0.9967071	0.96618474	even better than expected
0.98155665	0.7867308000000001	holster
0.99493116	0.8882198	throw the holster away and it s a perfect casing
0.80154014	0.6286761	gave it away
0.978276	0.82490313	great case
0.96078134	0.72177905	great case
0.14162326	0.5814111	looks great feels great but poor screen protection 
0.98090315	0.84435195	tough holster with kick stand
0.98654366	0.8224341999999999	great case
0.9835251	0.709201	great case 
0.9997665000000001	0.89046526	very pleased
0.9961244	0.8293181999999999	holster combo
0.029052137999999998	0.6993842	half of it is better than nothing
0.9982101000000001	0.80810696	i love this case
0.7135710999999999	0.7134206999999999	affects antenna
0.99395037	0.7583513000000001	extremely happy
0.9695865	0.7752583000000001	perfect for s3
0.9970629999999999	0.7803085	excellent holster great price
0.9740319	0.94655764	slim durable good looking 
0.15499768	0.63124716	broke my phone
0.375282	0.5783621999999999	sturdy gets the job done 
0.98942137	0.7992772	best case i have had
0.6970114000000001	0.81370056	decent case big logo
0.99719644	0.90922415	exactly as described very sturdy
0.9709946	0.89181894	excellent quality great idea some room for design improvement
0.08185071	0.71817034	nice product but not secure enough in the horizontal position
0.9423599	0.68023545	great case fits prefect and has lasted 6 months so far 
0.9418321	0.5958333	aduro case
0.37169814	0.8272245999999999	beware phone falls out when holster in horizontal position
0.023055881	0.44353190000000003	no good
0.0068558753000000005	0.60896266	not durable enough
0.9149773000000001	0.8423809999999999	it works and it looks great small issues
0.21211305	0.7505504	can t depend on it if you re active 
0.99447715	0.8218373999999999	really nice case
0.99820864	0.8468331	awesome case
0.9989841	0.92860836	excellent armored defense
0.58015305	0.77389264	best case that fits my need
0.98885864	0.7678305000000001	very nice design good fit 
0.9488450999999999	0.8409606	great case for the money
0.99804246	0.81223774	if you are reading this that means you should buy this case right now
0.9981836	0.76925135	aduro shell holster combo case for samsung galaxy s3
0.2310771	0.6350481	terrible case
0.88818586	0.93096757	nice case with kickstand and holster
0.2715134	0.7589861	clip isn t removable 
0.7158223000000001	0.761922	same as verizon
0.99056077	0.8041537	aduro shell holster for galaxy s3
0.9205697	0.7539816	best semi protective case for your sgs3
0.99863136	0.8621795	excellent quality case 
0.9693731	0.7529578	a great addition for a new phone
0.8949541	0.75601006	wow they really thought this one through
0.98593026	0.8044113	excellent shell
0.63472223	0.81614125	if you want your phone on your belt you need this 
0.44335315	0.7873024000000001	decent case but belt clip not removable
0.995101	0.79758584	phone case
0.051935256	0.6764225	phone falls out
0.9750091999999999	0.8296701999999999	great product bad delivery 
0.89005256	0.7395303000000001	cool case 
0.9720205	0.7107985	great holster case 
0.9636036	0.7847852	great price on great product
0.069095075	0.82513237	do not buy this case if you value your phone 
0.99588156	0.9013005999999999	great case for samsung galaxy s3
0.9836	0.89038587	best item i ve purchased for my phone
0.6893421	0.70624036	worth every penny and more
0.9997408999999999	0.94343996	excellent well designed shell holster for galaxy s3
0.7867983000000001	0.9304093000000001	exactly as advertised
0.9980293	0.7379813000000001	very great case 
0.8860698	0.6317476	great 
0.9751049	0.92619616	best case i ve seen for what i wanted
0.5966134	0.8251755	clip on feature showed
0.9430914	0.8134043000000001	great case kickstand holster
0.025131166	0.57422185	get what you pay for
0.99028957	0.90172666	great belt holster case
0.980613	0.73113036	yours truly amazons pickiest customer
0.99907833	0.85779226	quality for a good price
0.5497664000000001	0.41397209999999995	got u covered 
0.945377	0.84768677	better than i thought it would be 
0.58727056	0.3488536	great product at a great price 
0.14620984	0.74242723	beware if you re looking for something really rugged
0.9515200999999999	0.81265867	great cover 
0.9982097	0.8699288000000001	nice cover
0.9609116	0.7453044	aduro shell holster very good
0.31259948	0.71648335	does not protect the entire phone 
0.73742414	0.92099524	protects the phone but after a couple of weeks phone is loose in holster
0.9941424000000001	0.83506846	excellent case 
0.61654365	0.8032279	bad choice and worse design
0.95048046	0.8964228000000001	great case holster at a great price 
0.61325747	0.7450743000000001	a case for all seasons and reasons
0.12666753	0.7551051999999999	kickstand kicks a 
0.035076916	0.41275135	disappointing case
0.031469524	0.6697867	not so good for protection nice features though 
0.9822763000000001	0.79047894	nice 
0.8916699	0.8255821	suits the purpose
0.99469566	0.7557084	really good quality
0.89242435	0.81286013	thumbs up
0.85067046	0.7958797	just what i wanted
0.9812521000000001	0.757916	so far so good
0.9770798	0.9180417	great case for my needs
0.99381506	0.8756509	good solid shell and case
