sentiment_scores	genuineness_scores	summary
0.25974345	0.7353122	disapointed
0.50748956	0.8177327	battery life is amazing
0.98905694	0.9502671	very satisfied
0.6164038000000001	0.37454537	razr maxx hd
0.99096096	0.8271224	motorola s best yet
0.73337185	0.7034815	in love with this phone
0.8858938000000001	0.6821971	too expensive overall just a basic average phone 
0.9951687	0.7646718000000001	great phone
0.07783601	0.6130205	camera crap
0.96388537	0.7618425999999999	great phone and finally a phone with great battery life 
0.0052268207	0.62261933	fragile phone do not buy
0.9983443999999999	0.9100193999999999	great phone 
0.93367386	0.70804876	moto s back 
0.84000915	0.7083496	fast great battery life slightly heavy
0.78736424	0.63838214	hope your package doesn t go missing 
0.8005686	0.74311054	best phone in the game
0.07369521	0.7787374	better than dx2 but not as good as expected 
0.5133965	0.84544003	best overall phone out there
0.98920256	0.7187584	solid phone overall
0.98786104	0.85947883	nice but 
0.9495238000000001	0.907217	great battery but not perfect
0.8806086999999999	0.64046633	shatters
0.99989414	0.8587585999999999	this is the best phone in the world 
0.9970349000000001	0.94944227	extremely polished oozes quality 
0.9945313	0.73365253	motorola droid razr hd
0.81783396	0.8924431999999999	this is a huge step up from my droid x
0.2659577	0.72980064	razr maxx hd battery good camera bad
0.99624515	0.90533006	awesome phone 
0.6616904	0.6453338000000001	best droid out there
0.7295724	0.63974726	beautiful
0.99002486	0.8919511999999998	a great phone with a fantastic battery
0.99390876	0.8502829	awesome upgrade from iphone
0.99110067	0.79942167	what would you want more 
0.21678415	0.6362076	it was a used phone
0.69565195	0.7818659	wont charge
0.95586014	0.859509	the right tech
0.53863996	0.8474707	no usb mass storage limiting connecting to computer to move access files
0.06024164	0.5777563	this phone keeps turning off
0.9823574	0.81991947	the best phone you can buy right now
0.9719306999999999	0.9493860000000001	droid razr maxx hd vs iphone 5
0.8488858	0.79151297	love this phone
0.9548489	0.8649336999999999	razr maxx hd owner
0.044736594000000005	0.34059113	best phone i ve owned to date 
0.9998282	0.9394828000000002	the best phone i ve ever owned 
0.889208	0.77391994	long lasting durable phone
0.019109368	0.81914127	i used to love this phone 
0.25618017	0.8138359000000001	too many glitches 
0.0076915026000000004	0.58303887	motorola never fails to disappoint
0.9326226000000001	0.90049887	incredible piece of technology
0.24730226	0.5787587	unbelievably great phone 
0.92424357	0.7946371999999999	glad i got it
0.6479696999999999	0.85894334	razr hd maxx vs samsung galaxy s4 short trial 
0.8909644	0.7659018	great phone very satisfied
0.40971019999999997	0.67121446	good phone great battery life
0.9865844000000001	0.8319799000000001	love this phone
0.9707530999999999	0.76936114	best phone i have ever owned
0.94770575	0.79689896	get this phone you will not be disappointed 
0.4029199	0.6426257	good but should have shipped with 4 1
0.990991	0.91393065	freedom from the charging cord best smartphone yet 
0.9972594000000001	0.7834283000000001	wonderful phone
0.9861305	0.81002295	replacement for a droid x
0.13600929999999997	0.63836855	very deceiving you can get the phones cheaper by going to verizon
0.024231225	0.64005756	very disappointing
0.97829115	0.6502348000000001	this phone was built for me 
0.9682565999999999	0.87111056	unbelievable battery life
0.9666382	0.8252586	great smart phone 
0.9968715	0.96099794	review motorola droid razr maxx hd
0.9933185999999999	0.7697562	perfect 
0.98736024	0.8336414000000001	best phone available
0.99569905	0.8318151	razr max hd
0.32640925	0.8046901	drooling 
0.77752936	0.739462	bought off contract at vzw store 
0.9940002	0.8840171999999998	android phones keep getting easier and eaiser to use 
0.95055115	0.56945515	amazing phone
0.5393485	0.81188715	had 3 all junk
0.30887878	0.43890834	but there is no reason why a brand new phone should do random reboot on several times a day 
0.9517627000000001	0.7726721999999999	upgraded from the droid 3
0.9554885000000001	0.8755002000000001	really shows what some good design and engineering can do updated
0.021152407	0.49201167	don t buy it
0.095223755	0.7526151999999999	maybe i got a lemon edited up to 4 stars 
0.90876913	0.81023943	amazing technology
0.7925892	0.77522904	switched from iphone 4 and at t
0.99329245	0.84048223	great phone 
0.005894989000000001	0.61154026	not a global phone
0.9970966999999998	0.80042744	great phone
0.8908488999999999	0.7682954000000001	maxx
0.061978787	0.6163224	did not work
0.4614503	0.8131083	gps sucks
0.78443193	0.89904094	good solid but not flashy phone
0.97521645	0.8650384	great battery life after giving up on iphone
0.53721416	0.5533848000000001	droid razr maxx hd
0.78935874	0.7309215	battery 
0.20302552	0.67264897	going back
0.88802755	0.593889	question does it support gsm 
0.9759730999999999	0.7588949	very impressed
0.93079686	0.6674618	razr maxx hd iphone killer 
0.013402671000000001	0.5908803	buggy many features don t work
0.9968456	0.8422415000000001	absolutly the best phone 
0.0040643513000000004	0.76945055	motorola droid razr maxx
0.98288953	0.95923734	droid razr maxx 1 really big draw back 
0.8681506999999999	0.63701046	incredible quality phone from an american company
0.27219325	0.49163100000000004	camera is terrible
0.027387828	0.5979013000000001	great battery bad sound poor reception
0.99832976	0.81787586	best motorola yet 
0.98350793	0.8354163	gorgeous and effective phone
0.99549794	0.7739481	droid razor max hd
0.28866845	0.7355001999999999	great battery and network cannot trump laggy interface and bugs
0.5501437	0.81770825	terrible screen cannot be read when outside
0.92675066	0.79595387	overall best smartphone available
0.9857456	0.7359601	great battery life 
0.13812307	0.7677684	doesn t ship until december 
0.05059749	0.5115853	maxx disappointed 
0.2057482	0.60208094	great looking phone but extremely high radiation 
0.014893233999999998	0.5326221	it already broke 
0.3210327	0.785374	okay but going back to the s3
0.99328935	0.8224802999999999	great phone
0.98452437	0.8401141	awesome phone motorola s best yet
0.63295776	0.64335245	above average phone
0.9736474	0.90038115	this phone won over the s3 for me 
0.28382167	0.5928519	not as good as expected
0.9826344000000001	0.78645563	battery trumps everything else
0.966975	0.84321964	maxx hd beats iphone and siii updated absolute best phone 
0.91499925	0.88002104	battery life that kills
0.9734514999999999	0.7778399	wow
0.003814727	0.6351925	motorola razr hd maxx
0.15293729999999997	0.56426734	unhappy with phone
0.9985193000000001	0.8983787	excellent phone and quality
0.10439089	0.30686677	comment on previous review
0.91192675	0.87777203	mororola droid razr maxx hd 4g
0.7888868	0.7911706000000001	my best cell phone ever 
0.8155594	0.7298109	as powerful as a tablet
0.04627335	0.22077110000000003	piece of doo doo
0.9157523000000001	0.8129993000000001	end of contract important
0.9873046999999998	0.81909394	so far so good 
